{
  "$schema": "http://json-schema.org/draft-07/schema#",
  "$id": "https://github.com/phobos-dthorga/phobos-ostranauts/schemas/care.schema.json",
  "title": "Phobos care data pack",
  "type": "object",
  "additionalProperties": false,
  "properties": {
    "schemaVersion": {
      "type": "integer",
      "const": 1
    },
    "schema": {
      "type": "string",
      "const": "care"
    },
    "notes": {
      "type": "string",
      "description": "Free text for maintainers; ignored by the game."
    },
    "stations": {
      "type": "object",
      "additionalProperties": false,
      "patternProperties": {
        "^(bed|monitor)$": {
          "type": "object",
          "additionalProperties": false,
          "properties": {
            "notes": {
              "type": "string",
              "description": "Free text for maintainers; ignored by the game."
            },
            "idleKW": {
              "type": "number",
              "minimum": 0,
              "maximum": 2,
              "description": "Demand with nobody under care, kW; no more than workingKW."
            },
            "workingKW": {
              "type": "number",
              "exclusiveMinimum": 0,
              "maximum": 2,
              "description": "Demand while giving care, kW."
            }
          }
        }
      },
      "description": "Electrical demand by station: bed, monitor."
    },
    "admission": {
      "type": "object",
      "additionalProperties": false,
      "properties": {
        "notes": {
          "type": "string",
          "description": "Free text for maintainers; ignored by the game."
        },
        "bloodLost": {
          "type": "number",
          "exclusiveMinimum": 0,
          "maximum": 40,
          "description": "Blood lost at which a person counts as injured (the game: 40 is fatal); below 40."
        },
        "infection": {
          "type": "number",
          "exclusiveMinimum": 0,
          "maximum": 95,
          "description": "Infection at which a person counts as injured (the game: 95 is fatal); below 95."
        },
        "pain": {
          "type": "number",
          "exclusiveMinimum": 0,
          "maximum": 75,
          "description": "Pain at which a person counts as injured (the game: 75 knocks out); below 75."
        },
        "wound": {
          "type": "number",
          "exclusiveMinimum": 0,
          "maximum": 1,
          "description": "Worst wound cut or blunt damage, 0 to 1, at which a person counts as injured; below 1."
        },
        "dischargeShare": {
          "type": "number",
          "minimum": 0,
          "maximum": 1,
          "description": "A resting patient gets up below every threshold times this share; below 1."
        }
      },
      "description": "Who counts as injured, and when a resting patient has recovered."
    },
    "alerts": {
      "type": "object",
      "additionalProperties": false,
      "properties": {
        "notes": {
          "type": "string",
          "description": "Free text for maintainers; ignored by the game."
        },
        "bloodLost": {
          "type": "number",
          "exclusiveMinimum": 0,
          "maximum": 40
        },
        "infection": {
          "type": "number",
          "exclusiveMinimum": 0,
          "maximum": 95
        },
        "pain": {
          "type": "number",
          "exclusiveMinimum": 0,
          "maximum": 75
        }
      },
      "description": "When a Vigil-2 posts a caution (Medical 0.3.0); a bleeding wound always alerts."
    },
    "levels": {
      "type": "object",
      "additionalProperties": false,
      "patternProperties": {
        "^(bed)$": {
          "type": "object",
          "additionalProperties": false,
          "properties": {
            "notes": {
              "type": "string",
              "description": "Free text for maintainers; ignored by the game."
            },
            "weightlessHealing": {
              "type": "number",
              "minimum": 0.05,
              "maximum": 1,
              "description": "Share of normal wound healing a weightless patient keeps under care: 0.05 is the game's own, 1 removes the penalty."
            }
          }
        }
      },
      "description": "What a station adds to the game's own care (Medical 0.2.0)."
    },
    "treatments": {
      "type": "object",
      "additionalProperties": false,
      "patternProperties": {
        "^[A-Za-z0-9_-]{1,48}$": {
          "type": "object",
          "additionalProperties": false,
          "properties": {
            "notes": {
              "type": "string",
              "description": "Free text for maintainers; ignored by the game."
            },
            "test": {
              "type": "string",
              "description": "Which wounds it is for.",
              "enum": [
                "bleeding",
                "fracture",
                "spent-dressing"
              ]
            },
            "effect": {
              "type": "string",
              "description": "slot-item: the item goes onto the wound the game's own way.",
              "enum": [
                "slot-item"
              ]
            },
            "item": {
              "type": "string",
              "description": "The game item definition used up, one per treatment.",
              "pattern": "^[A-Za-z0-9_]{1,48}$"
            },
            "medicSeconds": {
              "type": "number",
              "minimum": 5,
              "maximum": 1800,
              "description": "How long a medic takes, in seconds; crew with the skill are quicker."
            },
            "skill": {
              "type": "string",
              "description": "A skill condition, such as SkillMedicalTrauma; crew with it are asked first. Leave out for anyone.",
              "pattern": "^[A-Za-z0-9_]{0,48}$"
            },
            "order": {
              "type": "integer",
              "minimum": 0,
              "maximum": 1000,
              "description": "Lower comes first; ties go by name."
            }
          },
          "required": [
            "test",
            "item",
            "medicSeconds"
          ]
        }
      },
      "description": "What a medic does for a patient in a Ward-3, by name (Medical 0.4.0)."
    }
  },
  "required": [
    "schemaVersion",
    "schema",
    "stations",
    "admission"
  ],
  "description": "Phobos Medical care pack: station power and admission thresholds. The healing is the game's own Recuperating."
}
